{
  "schemaVersion": 1,
  "mode": "fresh",
  "network": "preprod",
  "provider": "blockfrost",
  "tld": "cardano",
  "sld": "api",
  "runId": "20260720-232524",
  "createdAt": "2026-07-20T23:25:24.6714919+03:30",
  "sharedDir": "E:\\Computer Eng\\Projects\\Handshake\\dns-cli\\demo\\runs\\shared",
  "tldDir": "E:\\Computer Eng\\Projects\\Handshake\\dns-cli\\demo\\runs\\cardano",
  "sldRunDir": "E:\\Computer Eng\\Projects\\Handshake\\dns-cli\\demo\\runs\\cardano\\api\\20260720-232524"
}
