{
  "schemaVersion": 1,
  "mode": "fresh",
  "network": "preprod",
  "provider": "blockfrost",
  "tld": "ada",
  "sld": "www",
  "runId": "20260717-190505",
  "createdAt": "2026-07-17T19:05:05.8810556+03:30",
  "sharedDir": "E:\\Computer Eng\\Projects\\Handshake\\dns-cli\\demo\\runs\\shared",
  "tldDir": "E:\\Computer Eng\\Projects\\Handshake\\dns-cli\\demo\\runs\\ada",
  "sldRunDir": "E:\\Computer Eng\\Projects\\Handshake\\dns-cli\\demo\\runs\\ada\\www\\20260717-190505"
}
